{
  "type": "equation",
  "equation": {
    "expression": "\\int_0^1\\sin(x)\\,dx"
  },
  "annotations": {
    "bold": false,
    "italic": false,
    "strikethrough": false,
    "underline": false,
    "code": false,
    "color": "default"
  },
  "plain_text": "\\int_0^1\\sin(x)\\,dx",
  "href": null
}
